"","","","","",
"Raconteur","divine level unknown","Chaotic Good","art, humor, music, poetry","Kingdoms of Kalamar Campaign Setting",
"Rad","Intermediate deity","Lawful Neutral","Radiance","Warriors of Heaven",
"Rafiel","Intermediate deity","Neutral Good","shadow elves, Technology","Warriors of Heaven",
"Ragtha","divine level unknown","Lawful Neutral","The waters","The Unknown Gods",
"Rahda","divine level unknown","Chaotic Neutral","children","The Unknown Gods",
"Rahstri","divine level unknown","Neutral Evil","Strength in revenge","The Unknown Gods",
"Raiden","Intermediate deity/Greater deity","Chaotic Evil (Neutral)","arrow-making, thunder, weather","On Hallowed Ground, Legends & Lore (Second Edition), Deities & Demigods (First Edition), Dragon magazine #13 - The Japanese Mythos",
"Rain King","Demigoddess","Lawful Neutral","Rain, storms","Warriors of Heaven",
"Rainbow, The","divine level unknown","not listed","not listed","Dragon magazine #27 - The Mythos of Africa in Dungeons & Dragons",
"Rais","Lesser deity","not listed","intellect, silver dragonkind","Greyspace",
"Raiser, The","divine level unknown","Neutral Good","agriculture, fertility, harvest, life","Kingdoms of Kalamar Campaign Setting",
"Rakunth","Demigod","not listed","not listed","Dragon magazine #24 - Choir Practice at the First Church of Lawful Evil (Orthodox): The Ramifications of Alignment",
"Ralishaz","Intermediate deity/Lesser deity","Chaotic Neutral (Chaotic Evil)","Chance, ill luck, insanity, misfortune, randomness","http://www.wizards.com/rpga/downloads/LG_Deities.zip, Living Greyhawk Journal no. 3 - Gods of Oerth, Living Greyhawk Gazetteer, Player's Guide to Greyhawk, On Hallowed Ground, Greyspace, Greyhawk Adventures, The Temple of Elemental Evil, Dragon magazine #71 - The Deities & Demigods of the World of Greyhawk",
"Rallaster","divine level unknown","Chaotic Evil","murder, psychotic behavior, torture","Book of Vile Darkness",
"Ramenos","Lesser deity","Chaotic Evil","Decay, intoxication, somnolence","On Hallowed Ground, Monster Mythology",
"Ramman","Lesser deity","Lawful Neutral (Neutral)","duty, order, storms, thunder, vigilance, War","Lost Empires of Faerun, On Hallowed Ground, Deities & Demigods (First Edition)",
"Ran","Demigoddess","Chaotic Neutral","death, Waves, whirlpools","Gods, Demi-Gods & Heroes, Dragon magazine #110 - For Better or Norse: I",
"Randoril'thi","divine level unknown","Chaotic Good","Luck","Otherlands",
"Rao","Greater deity","Lawful Good","intellect, peace, reason, serenity","http://www.wizards.com/rpga/downloads/LG_Deities.zip, Complete Divine, Dragon magazine #294 - Beings of Power, Living Greyhawk Journal no. 3 - Gods of Oerth, Living Greyhawk Gazetteer, Warriors of Heaven, Player's Guide to Greyhawk, On Hallowed Ground, The Temple of Elemental Evil",
"Rapithwin","divine level unknown","Lawful Good","the ideal world, The noon-day heat","Dragon magazine #12 - The Persian Mythos",
"Rasan Korya","divine level unknown","not listed","Ambition","Dragon magazine #24 - Choir Practice at the First Church of Lawful Evil (Orthodox): The Ramifications of Alignment",
"Rat God","Lesser deity","Chaotic Evil","Rats, underground areas, wererats and sewers","Lankhmar, City of Adventure (Second Edition), Deities & Demigods (First Edition)",
"Rathanos","Lesser deity","Chaotic Good","energy, Fire","Warriors of Heaven",
"Ratri","Lesser deity/Demigoddess","Chaotic Neutral (Neutral Evil)","Night and darkness, thieves","On Hallowed Ground, Legends & Lore (Second Edition), Deities & Demigods (First Edition), Gods, Demi-Gods & Heroes",
"Ravanna","Lesser deity","Lawful Evil","deception, intrigue, Lies, rakshasas, tyranny","Dragon magazine #326 - Ecology of the Rakshasa, Dragon magazine #84 - Never the Same Thing Twice",
"Raven","Lesser deity/Greater deity","Chaotic Good","creation, nature, Trickery and deception","Legends & Lore (Second Edition), Deities & Demigods (First Edition)",
"Raxivort","Lesser deity","Chaotic Evil","Bats, Rats, wererats, Xvarts","Dragon magazine #359 - Class Acts: Divine: Forgotten Faiths, http://www.wizards.com/rpga/downloads/LG_Deities.zip, Living Greyhawk Journal no. 3 - Gods of Oerth, Living Greyhawk Gazetteer, Dragon magazine #264 - The Oeridian Lesser Gods, Player's Guide to Greyhawk, Dragon magazine #64 - Greyhawk's World",
"Razod","Greater deity","Neutral","Self-sufficience","Warriors of Heaven",
"Re-Horakhty (Horus-Re)","Greater deity","Lawful Good","kings, life, nobility, rulership, sun, supreme, vengeance","Sandstorm, Faiths & Pantheons, Deities & Demigods (Third Edition), Warriors of Heaven, Powers & Pantheons",
"Red God","Intermediate deity/Lesser deity","Chaotic Good (Chaotic Neutral) (Neutral)","Battle and war, Fire","Lankhmar, City of Adventure (Second Edition), Legends & Lore (Second Edition), Deities & Demigods (First Edition)",
"Red Knight","Demigoddess","Lawful Neutral","planning, strategy, Tactics","Faiths & Pantheons, Forgotten Realms Campaign Setting (Third Edition), Warriors of Heaven, Powers & Pantheons",
"Red Tiger","Demigod","Chaotic Neutral","Beast Cult","The Savage Frontier",
"Rellavar Danuvien","Lesser deity","Neutral Good","Frost sprites, protection from the elements (particularly the cold)","Dragon magazine #236 - The Seldarine Revisited",
"Remnis","Lesser deity","Neutral (Neutral Good)","giant eagles, service, Sky","Warriors of Heaven, On Hallowed Ground, Monster Mythology",
"Renenet","divine level unknown","not listed","Good Fortune","Gods, Demi-Gods & Heroes",
"Reorx","Greater deity","Neutral","artisans, creation, dwarves, engineering, gambling, smithing","Dragonlance Campaign Setting (Third Edition), Warriors of Heaven, On Hallowed Ground, Dragonlance Adventures",
"Repra","Demigod","Chaotic Evil","serpents","Dragon magazine #54 - Down-to-earth divinity",
"Rhea","Greater deity","Neutral Good","fertility, life","Warriors of Heaven, On Hallowed Ground, Legends & Lore (Second Edition)",
"Rhiannon","Greater deity","Neutral","queen of faeries, Witches","Dragon magazine #155 - The Folk of the Faerie Kingdom, The Unknown Gods",
"Riftmaster, The","divine level unknown","Neutral","magic","Kingdoms of Kalamar Campaign Setting",
"Rill Cleverthrush","Lesser deity","Lawful Neutral","creation, invention, Sky","Races of Stone",
"Rillifane Rallathil","Intermediate deity/Lesser deity","Chaotic Good","druids, nature, wild elves, wood elves, woodlands","http://www.wizards.com/rpga/downloads/LG_Deities.zip, Faiths & Pantheons, Demihuman Deities, Dragon magazine #191 - The Elven Pantheon - Completed!, Deities & Demigods (First Edition)",
"Rillifloham","divine level unknown","not listed","nature","Dragon magazine #24 - Choir Practice at the First Church of Lawful Evil (Orthodox): The Ramifications of Alignment",
"Risk","divine level unknown","Chaotic Neutral","gambling, Luck, thievery","Kingdoms of Kalamar Campaign Setting",
"Rissinis","divine level unknown","Neutral","Fishing","Imagine magazine #26 - The Gods of Pelinore",
"River Gods","divine level unknown","not listed","rivers","Dragon magazine #27 - The Mythos of Africa in Dungeons & Dragons",
"Rod","divine level unknown","Lawful Neutral","fertility","Dragon magazine #290 - Red Sails: Bright Sun, Mother Earth",
"Roknar","Lesser deity","Neutral Evil","Earth, Greed, intrigue, Lies","Races of Stone",
"Romas","divine level unknown","Chaotic Neutral","the sea","Dragon magazine #283 - Do-It-Yourself Deities",
"Rongo","divine level unknown","not listed","agriculture, cultivated foods, singing","Dragon magazine #20 - The Mythos of Polynesia in Dungeons & Dragons",
"Roofdrak","Demigod","Neutral","Canines","Dragon magazine #54 - Down-to-earth divinity, Deities & Demigods (First Edition)",
"Rotlord","divine level unknown","Chaotic Evil","disease, Epidemics, Plague, sickness, vermin","Kingdoms of Kalamar Campaign Setting",
"Roykin","Hero Goddess","Neutral Evil","cruelty","http://www.wizards.com/rpga/downloads/LG_Deities.zip, Living Greyhawk Journal no. 3 - Blood of Heroes, Living Greyhawk Journal no. 3 - Gods of Oerth",
"Rudd","Demigoddess","Chaotic Neutral (Chaotic Good)","Chance, good luck, skill","Dragon magazine #342 - Core Beliefs: Olidammara, http://www.wizards.com/rpga/downloads/LG_Deities.zip, Living Greyhawk Journal no. 3 - Gods of Oerth, Living Greyhawk Gazetteer, Dragon magazine #265 - The Oeridian Lesser Gods, Warriors of Heaven, Player's Guide to Greyhawk, The Temple of Elemental Evil",
"Rudra","Intermediate deity/Greater deity","Neutral Evil (Lawful Neutral)","disease, robbers and thieves, storms, the dead","On Hallowed Ground, Legends & Lore (Second Edition), Deities & Demigods (First Edition), Gods, Demi-Gods & Heroes",
"Ruornil","Lesser deity","Neutral","magic, moon, night","Warriors of Heaven, On Hallowed Ground, Birthright Campaign Setting",
"Ryujin","divine level unknown","not listed","not listed","Dragon magazine #13 - The Japanese Mythos",
"Saga","divine level unknown","not listed","history","Gods, Demi-Gods & Heroes",
"Saith","divine level unknown","Lawful Good","vengeance","Imagine magazine #26 - The Gods of Pelinore",
"Salturen","Lesser deity","Lawful Neutral","Justice","Dragon magazine #119 - The Uldra",
"Samuqan","divine level unknown","not listed","Cattle","Dragon magazine #16 - Near Eastern Mythos",
"Sarasuati","divine level unknown","not listed","Water and knowledge","Gods, Demi-Gods & Heroes",
"Sardior","Lesser deity","Neutral","Neutral dragons, night, psionics, secrets","http://www.wizards.com/default.asp?x=dnd/psm/20030124a",
"Sargonnas","Greater deity","Lawful Evil","conquest, Fire, intrigue, rage, strength, Vengance","Dragonlance Campaign Setting (Third Edition), On Hallowed Ground, Dragonlance Adventures",
"Sarula Iliene","Lesser deity","Chaotic Good","Lakes, nixies, streams, water magic","Warriors of Heaven, Dragon magazine #251 - Magic of the Seldarine",
"Sashu","divine level unknown","Lawful Neutral","Justice and blind beggars","The Unknown Gods",
"Saule","divine level unknown","Neutral Good","childbirths, music, nurturing life, sun, Weaving","Dragon magazine #290 - Red Sails: Bright Sun, Mother Earth",
"Savitri","Intermediate deity","Neutral Good","life, Light","Warriors of Heaven, On Hallowed Ground, Legends & Lore (Second Edition)",
"Savras","Demigod/Lesser deity","Lawful Neutral","divination, Divination magic, diviners, Fate, truth, truth-speakers","Faiths & Pantheons, Forgotten Realms Campaign Setting (Third Edition), Warriors of Heaven, Powers & Pantheons",
"Scahrossar","divine level unknown","Lawful Evil","pain, sadism, torture","Book of Vile Darkness",
"Scodem","divine level unknown","Lawful Neutral","The hunt","The Unknown Gods",
"Sedjima","divine level unknown","not listed","knowledge","Dragon magazine #24 - Choir Practice at the First Church of Lawful Evil (Orthodox): The Ramifications of Alignment",
"Segojan Earthcaller","Intermediate deity/Lesser deity","Neutral Good","Earth, nature, rock gnomes, the dead","http://www.wizards.com/rpga/downloads/LG_Deities.zip, Faiths & Pantheons, Living Greyhawk Journal no. 3 - Gods of Oerth, Warriors of Heaven, Demihuman Deities, On Hallowed Ground, Monster Mythology, Dragon magazine #61 - The Gods of the Gnomes",
"Sehanine Moonbow","Intermediate deity","Chaotic Good (Neutral Good)","death, dreams, far journeys, full moons, moon elves, Mysticism, The heavens, the stars, transcendence","http://www.wizards.com/rpga/downloads/LG_Deities.zip, Races of the Wild, Faiths & Pantheons, Living Greyhawk Journal no. 3 - Gods of Oerth, Living Greyhawk Gazetteer, Warriors of Heaven, Demihuman Deities, On Hallowed Ground, Monster Mythology",
"Seker","Lesser deity","Neutral Good","Light","Dragon magazine #283 - Do-It-Yourself Deities, Warriors of Heaven, On Hallowed Ground, Deities & Demigods (First Edition), Gods, Demi-Gods & Heroes",
"Sekolah","Lesser deity/Intermediate deity","Lawful Evil","Hunting, plunder, Sahuagin, tyranny","Stormwrack, http://www.wizards.com/rpga/downloads/LG_Deities.zip, Complete Divine, Defenders of the Faith, On Hallowed Ground, Monster Mythology, Deities & Demigods (First Edition)",
"Selan","divine level unknown","N/A","Beauty","Land of Fate",
"Seller of Souls, The","divine level unknown","Neutral Evil","murder, revenge","Kingdoms of Kalamar Campaign Setting",
"Selune","Intermediate deity/Lesser deity/Greater deity","Chaotic Good","Autumn, Beauty, diviners, dreams, Good and neutral lycanthropes, Love, marriage, moon, moonlight, navigation, navigators, purity, questers, seekers, stars, Tracking, wanderers","Faiths & Pantheons, Forgotten Realms Campaign Setting (Third Edition), Warriors of Heaven, Arcane Age: The Empire of Netheril, On Hallowed Ground, Faiths & Avatars, Forgotten Realms Adventures, Dragon magazine #54 - Down-to-earth divinity",
"Selvetarm","Demigod","Chaotic Evil","Drow warriors","Faiths & Pantheons, Demihuman Deities",
"Selyton","divine level unknown","Chaotic Evil","pain","The Unknown Gods",
"Semuanya","Lesser deity","Neutral","Lizardfolk, propagation, Survival","http://www.wizards.com/rpga/downloads/LG_Deities.zip, Complete Divine, Serpent Kingdoms, Defenders of the Faith, On Hallowed Ground, Monster Mythology, Deities & Demigods (First Edition)",
"Sera","Intermediate deity","Chaotic Neutral","Luck, Wealth","On Hallowed Ground, Birthright Campaign Setting",
"Serapis","Greater deity","Neutral Good","fertility, healing, the underworld","Dragon magazine #133 - The Imperial Gods",
"Serpent of Eternity, The","divine level unknown","not listed","not listed","Dragon magazine #27 - The Mythos of Africa in Dungeons & Dragons",
"Sess'innek","Demigod","Chaotic Evil","civilization, dominion","On Hallowed Ground, Monster Mythology",
"Set (Sseth)","Greater deity/Intermediate deity","Chaotic Evil (Lawful Evil)","Ambition, betrayal, chaos, Darkness, desert storms, destruction, drought, evil, evil magic, hate, Malice, murder, night, poison, predators and carrion-eaters, rot, snakes, the desert","Sandstorm, Serpent Kingdoms, Faiths & Pantheons, Deities & Demigods (Third Edition), Dragon magazine #283 - Do-It-Yourself Deities, Powers & Pantheons, On Hallowed Ground, Legends & Lore (Second Edition), Deities & Demigods (First Edition), Gods, Demi-Gods & Heroes",
"Shadow, The","divine level unknown","Chaotic Evil","Dark magic and the corruption of nature","Eberron Campaign Setting",
"Shaka-Nyorai","divine level unknown","not listed","not listed","Dragon magazine #13 - The Japanese Mythos",
"Shakak","Greater deity","Chaotic Evil","winter","Deities & Demigods (First Edition)",
"Shaliroi","divine level unknown","not listed","Water","Dragon magazine #24 - Choir Practice at the First Church of Lawful Evil (Orthodox): The Ramifications of Alignment",
"Shami-Amourae","Demigoddess","Chaotic Evil","Debased eros","Dungeon magazine #5 - The Stolen Power",
"Shan Hai Ching","Greater deity","Lawful Neutral","Wind and sea","Dragon magazine #283 - Do-It-Yourself Deities, Deities & Demigods (First Edition), Gods, Demi-Gods & Heroes",
"Shang-ti","Greater deity","Lawful Neutral (Lawful Good)","creation, leadership, social order, The heavens","Dragon magazine #283 - Do-It-Yourself Deities, Warriors of Heaven, On Hallowed Ground, Legends & Lore (Second Edition), Deities & Demigods (First Edition), Gods, Demi-Gods & Heroes",
"Shango","Greater deity","Chaotic Evil","power, storms, the Yoruba tribe","Dragon magazine #191 - An African Genesis, Dragon magazine #27 - The Mythos of Africa in Dungeons & Dragons",
"Shar","Greater deity","Neutral Evil","betrayal, caverns, dark, dungeons, forgetfulness, hatred, hiding places, Illusions, Lies, loss, murder, night, nightmares, seduction, sleep, the Underdark, thievery, thieves, treachery, Trickery, unrevealed secrets, winter","Faiths & Pantheons, Forgotten Realms Campaign Setting (Third Edition), Arcane Age: The Empire of Netheril, On Hallowed Ground, Faiths & Avatars, Forgotten Realms Adventures, Dragon magazine #54 - Down-to-earth divinity",
"Sharess","Demigoddess","Chaotic Good","Cats, excess, festhalls, Hedonism, lust, pleasure, pleasure seekers, sensual fulfillment","Faiths & Pantheons, Forgotten Realms Campaign Setting (Third Edition), Warriors of Heaven, Powers & Pantheons",
"Shargaas","Lesser deity/Intermediate deity","Chaotic Evil (Neutral Evil)","Darkness, night, Stealth, the Underdark, thieves, undead","http://www.wizards.com/rpga/downloads/LG_Deities.zip, Faiths & Pantheons, On Hallowed Ground, Monster Mythology, Dragon magazine #62 - The Gods of the Orcs",
"Sharindlar","Intermediate deity","Chaotic Good","courtship, dancing, fertility, healing, mercy, Romantic love, The moon","Faiths & Pantheons, Demihuman Deities",
"Shashuk","divine level unknown","Chaotic Evil","Servant of Kala Kala","The Unknown Gods",
"Shaundakul","Lesser deity","Chaotic Neutral","caravans, exploration, long-range traders, miners, Portals, travel, windghosts","Faiths & Pantheons, Forgotten Realms Campaign Setting (Third Edition), Warriors of Heaven, On Hallowed Ground, Faiths & Avatars",
"Sheela Peryroyl","Intermediate deity/Lesser deity","Neutral (Neutral Good)","agriculture, Beauty, dance, nature, Romantic love, song, weather","http://www.wizards.com/rpga/downloads/LG_Deities.zip, Races of the Wild, Faiths & Pantheons, Living Greyhawk Journal no. 3 - Gods of Oerth, Warriors of Heaven, Demihuman Deities, On Hallowed Ground, Monster Mythology, Dragon magazine #171 - Defenders of the Hearth, Dragon magazine #59 - The Gods of the Halflings",
"Shekinester (Ssharstrune)","Greater deity","Lawful Good/Chaotic Good/Neutral/Lawful Evil/Chaotic Evil (Neutral Evil) (Neutral)","acquisition, creation maintenance, destruction, knowledge, nagas, power, Varies by aspect","http://www.wizards.com/rpga/downloads/LG_Deities.zip, Complete Divine, Serpent Kingdoms, Defenders of the Faith, Warriors of Heaven, On Hallowed Ground, Monster Mythology",
"Shevarash","Demigod","Chaotic Neutral","crusades, Hatred of the drow, loss, revenge, vengeance","Weapons of Legacy, Faiths & Pantheons, Demihuman Deities",
"Sheyanna Flaxenstrand","Intermediate deity","Chaotic Good","Beauty, Love, passion","Races of Stone",
"Shi-Tenno","divine level unknown","not listed","protecting the world from the attacks of demons","Dragon magazine #13 - The Japanese Mythos",
"Shiallia","Demigoddess","Neutral Good","growth, korreds, Neverwinter Wood, the High Forest, woodland fertility, Woodland glades","Faiths & Pantheons, Forgotten Realms Campaign Setting (Third Edition), Warriors of Heaven, Powers & Pantheons, The Savage Frontier",
"Shichifukujin","Lesser deities","Chaotic Good, Lawful Good, Neutral Good","as listed, happiness collectively","Warriors of Heaven, On Hallowed Ground, Legends & Lore (Second Edition)",
"Shimmering One, The","divine level unknown","Chaotic Good","Beauty, moon","Kingdoms of Kalamar Campaign Setting",
"Shina-Tsu-Hiko","Intermediate deity","Chaotic Neutral","Winds","On Hallowed Ground, Legends & Lore (Second Edition)",
"Shinare","Intermediate deity","Lawful Neutral (Neutral)","commerce, freedom, travel, Wealth","Dragonlance Campaign Setting (Third Edition), On Hallowed Ground, Dragonlance Adventures",
"Shindra","divine level unknown","Lawful Evil","Dancing girls","The Unknown Gods",
"Shiva","divine level unknown","not listed","The beasts","Gods, Demi-Gods & Heroes",
"Shoki","divine level unknown","not listed","not listed","Dragon magazine #13 - The Japanese Mythos",
"Shou Hsing","Intermediate deity","Chaotic Neutral","Long life","Warriors of Heaven, On Hallowed Ground, Legends & Lore (Second Edition)",
"Shu","Intermediate deity/Lesser deity","Lawful Good","the atmosphere, the desert and light, the sky, Winds","Dragon magazine #283 - Do-It-Yourself Deities, Warriors of Heaven, On Hallowed Ground, Legends & Lore (Second Edition), Deities & Demigods (First Edition), Gods, Demi-Gods & Heroes",
"Shub-Niggurath","Intermediate deity/Lesser deity","Chaotic Neutral (Chaotic Evil)","Procreation","Call of Cthulhu d20, Deities & Demigods (First Edition)",
"Shudde M'ell","Demigod","Chaotic Neutral","Earth","Call of Cthulhu d20",
"Shulpae","divine level unknown","not listed","feasting","Dragon magazine #16 - Near Eastern Mythos",
"Siamorphe","Demigoddess","Lawful Neutral","human royalty, nobility, Nobles, rightful rule of nobility","Faiths & Pantheons, Forgotten Realms Campaign Setting (Third Edition), Warriors of Heaven, Powers & Pantheons",
"Siduri","divine level unknown","not listed","not listed","Dragon magazine #16 - Near Eastern Mythos",
"Sif","Lesser deity/Intermediate deity","Chaotic Good","dueling, excellence, skill, War, warriors","Deities & Demigods (Third Edition), Dragon magazine #283 - Do-It-Yourself Deities, Warriors of Heaven, On Hallowed Ground, Legends & Lore (Second Edition), Deities & Demigods (First Edition), Gods, Demi-Gods & Heroes",
"Sifraniska","divine level unknown","Lawful Evil","Hamaguans","http://www.wizards.com/default.asp?x=dnd/psb/20030523c",
"Silvanus","Greater deity","Neutral","druids, Forests, wild nature","Faiths & Pantheons, Forgotten Realms Campaign Setting (Third Edition), Warriors of Heaven, On Hallowed Ground, Faiths & Avatars, Forgotten Realms Adventures, Dragon magazine #54 - Down-to-earth divinity, Deities & Demigods (First Edition), Gods, Demi-Gods & Heroes",
"Silver Flame, The","divine level unknown","Lawful Good","protection from supernatural evil","Eberron Campaign Setting",
"Sinakad","divine level unknown","Lawful Good","Mercy for the trapped","The Unknown Gods",
"Sinetar","divine level unknown","not listed","not listed","Gods, Demi-Gods & Heroes",
"Sirrion","Intermediate deity","Chaotic Neutral (Neutral)","change, Fire, strength, sun","Dragonlance Campaign Setting (Third Edition), On Hallowed Ground, Dragonlance Adventures",
"Siva","Greater deity/Intermediate deity","Neutral Evil","destruction","On Hallowed Ground, Legends & Lore (Second Edition)",
"Sixin","Intermediate deity/Lesser deity","Lawful Evil","deception, intruige, War, Xills","http://www.wizards.com/rpga/downloads/LG_Deities.zip, Complete Divine, Defenders of the Faith",
"Sjofn","divine level unknown","not listed","Love","Gods, Demi-Gods & Heroes",
"Skadi","Lesser deity","Neutral (Chaotic Good)","Earth, Mountains, skiing, winter","Deities & Demigods (Third Edition), Dragon magazine #110 - For Better or Norse: I",
"Skama","divine level unknown","Neutral Good","agriculture, childbirth, Rime Isle","Lankhmar, City of Adventure (Second Edition)",
"Skerrit","Lesser deity","Neutral Good (Neutral) (Chaotic Good)","Centaurs, Community, natural balances","http://www.wizards.com/rpga/downloads/LGBBSS_v1-0.zip, http://www.wizards.com/rpga/downloads/LG_Deities.zip, Complete Divine, Defenders of the Faith, Warriors of Heaven, On Hallowed Ground, Monster Mythology, Deities & Demigods (First Edition)",
"Skiggaret","Demigod","Chaotic Evil","fear","On Hallowed Ground, Monster Mythology",
"Skillful & Percipient One","divine level unknown","not listed","Craftsmanship and magic","Dragon magazine #16 - Near Eastern Mythos",
"Skoraeus Stonebones","Intermediate deity/Lesser deity","Neutral","arts and craftsmanship (stone giants only), stone giants","http://www.wizards.com/rpga/downloads/LG_Deities.zip, Complete Divine, Defenders of the Faith, On Hallowed Ground, Giantcraft, Monster Mythology, Deities & Demigods (First Edition)",
"Slarsken Obel","divine level unknown","not listed","Evolution (social Darwinism)","Dragon magazine #24 - Choir Practice at the First Church of Lawful Evil (Orthodox): The Ramifications of Alignment",
"Snake (Snake-Man)","Lesser deity/Greater deity","Neutral Good (Chaotic Good)","Reptiles and aging","Legends & Lore (Second Edition), Deities & Demigods (First Edition)",
"Sneel","Lesser deity","Chaotic Evil","Rats","Dragon magazine #54 - Down-to-earth divinity",
"Snotra","divine level unknown","not listed","Virtue","Gods, Demi-Gods & Heroes",
"So","divine level unknown","Lawful Good","lightning, ram-men, retribution, thunder, Zande witches","Dragon magazine #215 - The Deities of Africa",
"Sobek (Sebek) (Suchos)","Demigod/Lesser deity","Lawful Evil (Neutral Evil)","crocodiles, marshes, river hazards, rivers, Water, werecrocodiles, wetlands","Sandstorm, Serpent Kingdoms, Deities & Demigods (Third Edition), Powers & Pantheons, Imagine magazine #16 - Two Powerful New Immortals for the AD&D Game",
"Sog-Morthoth","divine level unknown","not listed","Devolution","Dragon magazine #24 - Choir Practice at the First Church of Lawful Evil (Orthodox): The Ramifications of Alignment",
"Soggelos","Lesser deity","Chaotic Good","creativity, Water","Ghostwalk",
"Solanil","divine level unknown","Neutral Good","oases","Sandstorm",
"Solinari","Intermediate deity","Lawful Good","arcane knowledge, magic","Dragonlance Campaign Setting (Third Edition), Warriors of Heaven, On Hallowed Ground, Dragonlance Adventures",
"Solis","divine level unknown","Lawful Good","the sun","Dragon magazine #283 - Do-It-Yourself Deities",
"Solonor Thelandira","Intermediate deity/Lesser deity","Chaotic Good","archery, Hunting, wilderness survival","http://www.wizards.com/rpga/downloads/LG_Deities.zip, Faiths & Pantheons, Living Greyhawk Journal no. 3 - Gods of Oerth, Warriors of Heaven, Demihuman Deities, On Hallowed Ground, Monster Mythology, Dragon magazine #60 - The Gods of the Elves",
"Soma","Intermediate deity","Chaotic Good","moon, plants, prophecy","Warriors of Heaven, Legends & Lore (Second Edition)",
"Sonponno","divine level unknown","Neutral Evil","Smallpox and related diseases","Dragon magazine #191 - An African Genesis",
"Soorinek","Demigoddess","Lawful Evil","betrayal, intrigue, secrets","Races of Destiny",
"Sotillion","Lesser deity","Chaotic Good (Chaotic Neutral)","comfort, ease, South wind, summer","http://www.wizards.com/rpga/downloads/LG_Deities.zip, Living Greyhawk Journal no. 3 - Gods of Oerth, Living Greyhawk Gazetteer, Dragon magazine #264 - The Oeridian Lesser Gods, Warriors of Heaven, Player's Guide to Greyhawk, The Temple of Elemental Evil",
